{
  "$schema": "../schemas/repository-presentation-inventory-v1.schema.json",
  "schema": "egohygiene.pace.repository-presentation-inventory/v1",
  "organization": "egohygiene",
  "observedAt": "2026-08-31T15:30:00Z",
  "collection": {
    "mode": "read-only",
    "networkRequired": true,
    "credentialsEmbedded": false,
    "privateDetailsPublished": false
  },
  "contracts": {
    "hygiene": {
      "version": "1.0.0-alpha.1",
      "status": "proposed",
      "revision": "cb2ed63425d29abada2d2bbb43a3b3e59d11aeb8",
      "digest": "44e0881519350e6747723995939c79c6fb4659e38a74b2c32e409866e7a186ba"
    },
    "identity": {
      "version": "1.0.0",
      "revision": "3c2fd3141371b355628e81f66f63159f19d63338"
    },
    "holon": {
      "version": "1.0.0",
      "revision": "4d436b631ea82c463d3a6a04b5664633f3c64b4c",
      "blueprintGitBlobSha": "f16349494be8d917253dfffa3b942698fa0cbcf5"
    },
    "egolint": {
      "version": "0.1.0-alpha.1",
      "revision": "4efe92a2609b3384fcf3b5cda343a4f64d108824"
    }
  },
  "policy": {
    "unknownRepository": "fail-closed",
    "writesBeforeReview": false,
    "proposalMode": "one-repository-per-reviewed-proposal",
    "missingFacts": "block",
    "missingAssets": "block",
    "egolintBeforeProposal": true
  },
  "canaryWave": [
    {
      "repository": "egohygiene/mantle",
      "role": "small-tool"
    },
    {
      "repository": "egohygiene/identity",
      "role": "customized"
    },
    {
      "repository": "egohygiene/antidote",
      "role": "publication-product"
    }
  ],
  "repositories": [
    {
      "repository": "egohygiene/.github",
      "visibility": "public",
      "archived": false,
      "defaultBranch": "main",
      "profile": "minimal",
      "lifecycle": "active",
      "customization": "small",
      "adoptionState": "not_applicable",
      "reasons": [
        "Organization metadata repository uses its profile README and is outside product presentation rollout."
      ],
      "canaryRole": null,
      "observed": {
        "representedCommit": "1a80cd5d436409b96532ba3dd9edfd892e3b9aad",
        "readme": {
          "status": "present",
          "gitBlobSha": "7d960edaacbb1e9e63fba253c96523c3a085d2d3",
          "managedRegion": false
        },
        "identityPackage": {
          "status": "missing",
          "descriptorPath": "assets/identity/repository-presentation/repository-presentation.json",
          "manifestPath": "assets/identity/repository-presentation/repository-presentation-manifest.json"
        },
        "facts": {
          "status": "unassessed"
        },
        "egolint": {
          "status": "not_run",
          "validatorRevision": "4efe92a2609b3384fcf3b5cda343a4f64d108824",
          "reportDigest": null
        }
      },
      "exception": null
    },
    {
      "repository": "egohygiene/aether",
      "visibility": "public",
      "archived": false,
      "defaultBranch": "main",
      "profile": "library",
      "lifecycle": "active",
      "customization": "rich",
      "adoptionState": "blocked",
      "reasons": [
        "Identity repository-presentation package is missing.",
        "Canonical presentation facts have not been assessed.",
        "Pinned Egolint report has not run."
      ],
      "canaryRole": null,
      "observed": {
        "representedCommit": "8a2a3d08f3aa9da3847bd5277843506ab855192e",
        "readme": {
          "status": "present",
          "gitBlobSha": "9bc4540dd55a63f1ef896fae1057d2203ca1bf18",
          "managedRegion": false
        },
        "identityPackage": {
          "status": "missing",
          "descriptorPath": "assets/identity/repository-presentation/repository-presentation.json",
          "manifestPath": "assets/identity/repository-presentation/repository-presentation-manifest.json"
        },
        "facts": {
          "status": "unassessed"
        },
        "egolint": {
          "status": "not_run",
          "validatorRevision": "4efe92a2609b3384fcf3b5cda343a4f64d108824",
          "reportDigest": null
        }
      },
      "exception": null
    },
    {
      "repository": "egohygiene/akashic",
      "visibility": "public",
      "archived": false,
      "defaultBranch": "main",
      "profile": "publication",
      "lifecycle": "active",
      "customization": "rich",
      "adoptionState": "blocked",
      "reasons": [
        "Identity repository-presentation package is missing.",
        "Canonical presentation facts have not been assessed.",
        "Pinned Egolint report has not run."
      ],
      "canaryRole": null,
      "observed": {
        "representedCommit": "2f2e8c6ebd1456092a047809865b5d2dd909e0f9",
        "readme": {
          "status": "present",
          "gitBlobSha": "99770e2d7f0f80d86091038adb0ad812020fdf91",
          "managedRegion": false
        },
        "identityPackage": {
          "status": "missing",
          "descriptorPath": "assets/identity/repository-presentation/repository-presentation.json",
          "manifestPath": "assets/identity/repository-presentation/repository-presentation-manifest.json"
        },
        "facts": {
          "status": "unassessed"
        },
        "egolint": {
          "status": "not_run",
          "validatorRevision": "4efe92a2609b3384fcf3b5cda343a4f64d108824",
          "reportDigest": null
        }
      },
      "exception": null
    },
    {
      "repository": "egohygiene/aniflow",
      "visibility": "public",
      "archived": false,
      "defaultBranch": "main",
      "profile": "cli",
      "lifecycle": "active",
      "customization": "rich",
      "adoptionState": "blocked",
      "reasons": [
        "Identity repository-presentation package is missing.",
        "Canonical presentation facts have not been assessed.",
        "Pinned Egolint report has not run."
      ],
      "canaryRole": null,
      "observed": {
        "representedCommit": "e704141742a7a55e486d9f24a7c97d9d2283f326",
        "readme": {
          "status": "present",
          "gitBlobSha": "d7f210625bc4d8e540e1dd79cf36b7401efeca17",
          "managedRegion": false
        },
        "identityPackage": {
          "status": "missing",
          "descriptorPath": "assets/identity/repository-presentation/repository-presentation.json",
          "manifestPath": "assets/identity/repository-presentation/repository-presentation-manifest.json"
        },
        "facts": {
          "status": "unassessed"
        },
        "egolint": {
          "status": "not_run",
          "validatorRevision": "4efe92a2609b3384fcf3b5cda343a4f64d108824",
          "reportDigest": null
        }
      },
      "exception": null
    },
    {
      "repository": "egohygiene/antidote",
      "visibility": "public",
      "archived": false,
      "defaultBranch": "main",
      "profile": "publication",
      "lifecycle": "incubating",
      "customization": "rich",
      "adoptionState": "blocked",
      "reasons": [
        "Identity repository-presentation package is missing.",
        "Canonical presentation facts have not been assessed.",
        "Pinned Egolint report has not run."
      ],
      "canaryRole": "publication-product",
      "observed": {
        "representedCommit": "3cf642903fcc676a7bf59afb045bc83a968ca80d",
        "readme": {
          "status": "present",
          "gitBlobSha": "09f166758a19068a23bc277b286a4baef338a4b9",
          "managedRegion": false
        },
        "identityPackage": {
          "status": "missing",
          "descriptorPath": "assets/identity/repository-presentation/repository-presentation.json",
          "manifestPath": "assets/identity/repository-presentation/repository-presentation-manifest.json"
        },
        "facts": {
          "status": "unassessed"
        },
        "egolint": {
          "status": "not_run",
          "validatorRevision": "4efe92a2609b3384fcf3b5cda343a4f64d108824",
          "reportDigest": null
        }
      },
      "exception": null
    },
    {
      "repository": "egohygiene/athena",
      "visibility": "public",
      "archived": false,
      "defaultBranch": "main",
      "profile": "publication",
      "lifecycle": "incubating",
      "customization": "small",
      "adoptionState": "blocked",
      "reasons": [
        "Identity repository-presentation package is missing.",
        "Canonical presentation facts have not been assessed.",
        "Pinned Egolint report has not run."
      ],
      "canaryRole": null,
      "observed": {
        "representedCommit": "75b4d48007a1747615220cfd0d1b5677e867b7bc",
        "readme": {
          "status": "present",
          "gitBlobSha": "258b3e257279ce993bb78bdea14db79941efab09",
          "managedRegion": false
        },
        "identityPackage": {
          "status": "missing",
          "descriptorPath": "assets/identity/repository-presentation/repository-presentation.json",
          "manifestPath": "assets/identity/repository-presentation/repository-presentation-manifest.json"
        },
        "facts": {
          "status": "unassessed"
        },
        "egolint": {
          "status": "not_run",
          "validatorRevision": "4efe92a2609b3384fcf3b5cda343a4f64d108824",
          "reportDigest": null
        }
      },
      "exception": null
    },
    {
      "repository": "egohygiene/beacon",
      "visibility": "public",
      "archived": false,
      "defaultBranch": "main",
      "profile": "publication",
      "lifecycle": "incubating",
      "customization": "rich",
      "adoptionState": "blocked",
      "reasons": [
        "Identity repository-presentation package is missing.",
        "Canonical presentation facts have not been assessed.",
        "Pinned Egolint report has not run."
      ],
      "canaryRole": null,
      "observed": {
        "representedCommit": "e846695648f7fc2ae710d1df6939f06b6460de82",
        "readme": {
          "status": "present",
          "gitBlobSha": "c833aa971bfbbe0b5f4b8b7cb14daeec163e7e80",